text,label,label_text,llama31_simple,llama31_advanced,llama31_conservative,mistral7b_simple,mistral7b_advanced,mistral7b_conservative
i feel so unloved without you next to me but when im with you,0,sadness,sadness,,sadness,sadness,sadness,sadness
i forced myself to keep going back even though they made me feel consistently uncomfortable but after a while i just gave up as i saw no point,4,fear,sadness,,sadness,sadness,sadness,sadness
i have a feeling hell be the kid up there shooting daggers out of his eyes annoyed that hes standing up there holding flowers,3,anger,anger,,anger,anger,anger,anger
i love a hearty chat where i mean everything that i say and laugh from the heart gut w e not because i wanna let the person feel im entertained,1,joy,love,,love,joy,anger,joy
i work myself like crazy doing extra stuff around the house or volunteering and serving other people in an attempt to feel productive and useful to someone anyone pleeeeeease,1,joy,sadness,,sadness,sadness,sadness,sadness
i feel a little hesitant to leave this time,4,fear,sadness,,sadness,fear,fear,sadness
i just feel tender,2,love,love,,love,love,joy,love
i always feel sympathetic for those that do as well because life can be really hard on you sometimes when you do have alot of pride,2,love,sadness,,sadness,sadness,sadness,sadness
i just feel that if i end our marriage he deserves a truthful explanation,1,joy,anger,,sadness,sadness,sadness,sadness
i feel fake because i think if you really want to have a good conversation and make good contact you have to appear especially self confident and even risk talking to some people which are no good to talk to at all until you meet one person which you have a good connection to,0,sadness,sadness,,sadness,sadness,sadness,sadness
i have strong feelings about being faithful,2,love,love,,sadness,,love,love
i cant feel anything like they said why does everything always hurt so bad,0,sadness,sadness,,sadness,sadness,sadness,sadness
i will nolonger tell anybody how i feel or what im thinking cause all it seems to do is get me more hated than i already am,0,sadness,anger,,anger,sadness,sadness,sadness
i can imagine most young people might feel resentful about the attention their sibling was getting while also feeling guilt at the same time,3,anger,sadness,,sadness,anger,sadness,
i just want that feeling of not caring about unnecessary stuff like i felt before,2,love,sadness,,sadness,sadness,sadness,sadness
i feel bothered by any of these things i open a door,3,anger,anger,,anger,anger,anger,anger
i feel like an indecisive idiot,4,fear,sadness,anger,anger,,sadness,anger
i vented my feelings towards the pathetic excuse of a communicat,0,sadness,anger,,anger,anger,anger,anger
im thankful because i feel somewhat energetic instead of the dead fish that i would become every time every chemo,1,joy,joy,,joy,,sadness,joy
i got up saturday morning feeling like crud but determined not to let it get the best of me,1,joy,anger,,anger,sadness,sadness,sadness
i started out feeling discouraged this morning,0,sadness,sadness,,sadness,sadness,sadness,sadness
i feel empty after cheated in the name of friendship i was broken,0,sadness,sadness,,sadness,sadness,sadness,sadness
i suppose if one was feeling generous one could say i was stressed by the elevator ride,1,joy,anger,,anger,fear,fear,
i have come to understand that feelings are neither positive nor negative,1,joy,sadness,,sadness,,joy,
i believe that with our minds focused on the daily rat race our bodies simply forget how to feel vital and free a classic case of you lose what you dont use,1,joy,sadness,,sadness,,sadness,
i used to be able to hang around talk with the cashier when i was putting away my money now i feel rushed and stressed if i take a second to fumble with the coins and put them in my purse,3,anger,anger,,sadness,sadness,sadness,sadness
i kinda get real attached and excited when i feel that way and i never handle things as well as others would,1,joy,sadness,,joy,sadness,joy,joy
i feel sorta vain,0,sadness,sadness,,sadness,sadness,joy,
i feel a kind of dull grief over it,0,sadness,sadness,,sadness,sadness,sadness,sadness
i feel to aid other women with infertility disorders this valuable individual guidance is offered for a restricted number of people,1,joy,sadness,,sadness,,joy,
i was ambushed again it was apparently my fault again i feel worthless,0,sadness,sadness,,sadness,sadness,sadness,sadness
i feel the creative juices beginning to flow again,1,joy,joy,,joy,joy,joy,joy
im already feeling pretty festive this year even though its only november,1,joy,joy,,joy,joy,joy,joy
i was feeling homesick for the annual easter breakfast and service at church this morning at when we left to hike up mt precipice for the sunrise,0,sadness,sadness,,sadness,sadness,sadness,sadness
i feel like i should be supporting them somehow but im not sure how,1,joy,sadness,,sadness,sadness,sadness,sadness
i don t always feel like i have amazing style and most days i choose comfort over anything else but there is one thing that i feel makes all the difference in how i feel about myself and that is makeup,1,joy,joy,,joy,joy,joy,joy
i wept while jackson slept feeling overwhelmed by the feeling that i don t want to die,4,fear,sadness,,sadness,sadness,sadness,sadness
i ate something wrong so i feel terrible all day,0,sadness,sadness,,sadness,,sadness,sadness
i like the fresh feeling of sweet he gave me,1,joy,joy,,joy,joy,joy,joy
i often use disney to cheer me up when im feeling low and these past couple days have been no exception,0,sadness,sadness,,joy,sadness,joy,joy
i wanted to feel him in my hands and reached out to take him into my waiting eager mouth,1,joy,,,,love,love,love
i could have expected in every way and i was feeling a bit overwhelmed at that point how quickly life changed in the past weeks,4,fear,sadness,,sadness,sadness,sadness,sadness
i always feel troubled when we re on the road touring living in a van or more recently in the circus buses no place to hang my hat as the song lyric has it,0,sadness,sadness,,sadness,sadness,sadness,sadness
i feel fine about feeling well fine,1,joy,joy,,joy,joy,joy,joy
i always feel stupid afterwards,0,sadness,sadness,,sadness,sadness,sadness,sadness
i am being over dramatic but i do feel very strongly for her and i am resolved to speak with her next chance i get,1,joy,love,,love,love,love,love
i was having an awful year racing and was feeling exhausted all the time,0,sadness,sadness,,sadness,sadness,sadness,sadness
i sat there cold i flashed back to going to the hockey city classic and the degree weather and it feeling just as cold even though there was about a degree difference this night,3,anger,sadness,,sadness,sadness,sadness,sadness
im feeling a lot more optimistic about my future,1,joy,joy,,joy,joy,joy,joy
i get frustrated that unresolved issues from my past have had a severe negative effect on my behavior and feel he must be angry that i have not resolved them by now,3,anger,sadness,,sadness,anger,anger,anger
i am feeling irritated anxious which is often then i dont even like my kids touching me,3,anger,anger,,anger,anger,anger,anger
i was feeling fairly keen,1,joy,joy,joy,joy,joy,joy,joy
i am feeling a little apprehensive about the whole thing,4,fear,fear,fear,fear,fear,fear,fear
i feel really inspired,1,joy,joy,,joy,joy,joy,joy
i can cycle further than ever before and the feeling of finishing the manchester to blackpool miles then not being at all bothered at having to ride an extra mile to put,3,anger,joy,,joy,joy,joy,joy
i declined to purchase any this time i enjoyed feeling squishing and project thinking all the divine yarn,1,joy,joy,,joy,joy,joy,joy
i feel crappy i eat crappy,0,sadness,sadness,,sadness,sadness,sadness,sadness
i know she shes the only one who provides income to my family right now but it feels like shes putting it up in our face that shes supporting us,1,joy,anger,,anger,,anger,anger
i feel so disgusted when i see blood and feel like faiting and also when people eat raw meat in front of me,3,anger,,,,anger,fear,fear
i feel like they don t think it s sincere when it really is she told us exclusively,1,joy,sadness,,sadness,,fear,sadness
i decide that picking the easy route would get me nowhere and i feel like other people want me tortured so i follow the blue path,4,fear,anger,,anger,anger,sadness,anger
i will try and stay focused in order to avoid that feeling of a reluctant finish,4,fear,sadness,,sadness,sadness,sadness,
i still feel a little weird and uncertain,4,fear,sadness,,sadness,,fear,
i walked under the refuge feeling it was the perfect shelter from a storm,1,joy,sadness,,sadness,fear,joy,fear
i feel i was so innocent to have only one dream to fill my brain and to be crazy about it,1,joy,sadness,,sadness,sadness,joy,joy
i feel less alone,0,sadness,sadness,,sadness,joy,joy,joy
i feel that this is a highly talented bunch when roling on all cyclinders,1,joy,,,joy,joy,joy,joy
ive been doing hour weeks and ill get paid for the extra time but i am starting to feel a bit abused they are putting a lot of pressure on me to look after both kids and do all of the cooking and cleaning,0,sadness,anger,,anger,anger,anger,anger
i can feel that they are kind friendly and can understand my feelings,1,joy,love,,love,joy,joy,joy
i feel productive and active but i have the balance i need,1,joy,joy,,joy,joy,joy,joy
i feel so fearless in these post grieving days,1,joy,joy,,joy,fear,fear,fear
im not gonna lie i was kinda sad and down and feeling pretty lonely,0,sadness,sadness,,sadness,sadness,sadness,sadness
i set aside that feeling and happily helped them now that every thing was been normalized and the students had liked me they change my schedule and i am just forgotten to oblivion,2,love,sadness,,sadness,sadness,sadness,sadness
i never feel like anythings getting resolved with my counseling so i just drift away,1,joy,sadness,,sadness,sadness,sadness,sadness
i had just hiked up and down a long steep hillside loaded with grass and bushes so i was feeling pretty doubtful id be able to find it,4,fear,sadness,,sadness,fear,fear,fear
i feel like nine times out of as long as you re determined and keen it tends to work out anyway,1,joy,joy,,joy,joy,joy,joy
i realized that i would be sad to leave this plane so soon and that just because i am feeling unloved and rejected there is no need to transfer those feelings of sadness on to those of my children left behind who i know do love and appreciate me and their father,0,sadness,sadness,,sadness,sadness,sadness,sadness
i have a lot going on in my life and feel overwhelmed,4,fear,sadness,,sadness,sadness,sadness,sadness
i admit im feeling a little bit unloved at this point,0,sadness,sadness,,sadness,sadness,sadness,sadness
i feel like that im hated by most of the girls is it becoz im a good dancer,0,sadness,sadness,anger,sadness,anger,fear,anger
i just feel its one of those things you dont talk about too much because then too many people come to know and then the plan doesnt taste as sweet nor does it feel like a plan,2,love,sadness,,sadness,sadness,fear,
i dropped martin back off i was the dd i pulled in and because i was feeling exceptionally outgoing waved and talked to some of my neighbors downstairs,1,joy,joy,,joy,joy,joy,
i know its easy to feel a little envious of me and i cant tell you that you shouldnt,3,anger,sadness,,sadness,,joy,
i highly recommend visiting on a wednesday if youre able because its less crowded so you get to ask the farmers more questions without feeling rude for holding up a line,3,anger,joy,,joy,joy,joy,joy
i have an ed i will tell you that i know i shouldn t feel shamed of eating a protein bar for breakfast and the fact that i ate one isn t what makes me shameful it s the fact i didn t make it is what made me hang my head and tuck tail,0,sadness,sadness,,sadness,sadness,sadness,sadness
i feel empty inside not surprising considering i havent eaten all day,0,sadness,sadness,,sadness,sadness,sadness,sadness
i feel a bit calm now,1,joy,,,,,joy,joy
i feel scared anxious,4,fear,fear,,fear,fear,fear,fear
i grabbed my dog and hugged her fiercly for the next hour or so until i began to feel a bit like myself again but i havent completly shaken the feeling and have been feeling rather depressed anxious all day,4,fear,sadness,,sadness,sadness,sadness,sadness
i feel so needy latley,0,sadness,sadness,,sadness,sadness,sadness,sadness
i was feeling very anxious this song came on the radio as soon as i got in the car,4,fear,fear,anger,anger,fear,fear,fear
im pretty sure and its been about a week and a half so although im feeling kind of betrayed and disillusioned by men at the moment everythings okay,0,sadness,sadness,,sadness,anger,sadness,sadness
i cant think of any emotional state that is worse than feeling generally worthless and unlovable,0,sadness,sadness,,sadness,sadness,sadness,sadness
i have better things to do than to feel humiliated,0,sadness,anger,,anger,anger,anger,anger
i feel i can only hope im not alone in these thoughts and im sure to all you fellow exchange students you probably have the same thoughts in mind with at least some of this listed some might say being an exchange student is unlike any other experience,0,sadness,sadness,,sadness,sadness,joy,sadness
i feel very saddened that the king whom i once quite respected as far as monarchs go was ineffectual at best,1,joy,sadness,,sadness,sadness,sadness,sadness
i feel ive ignored it too long this year,0,sadness,sadness,,sadness,sadness,sadness,sadness
i feel i should as a gracious gesture apologizing for my latest post about the osp and the rand license terms,2,love,sadness,,sadness,anger,anger,anger
i appreciate how clean their lifestyles are even though i admit there were a few moments where the complete aversion to substances sex made me feel a little repressed,0,sadness,sadness,,sadness,sadness,sadness,sadness
i just cant help but feel like i must protect this innocent being,1,joy,love,,love,fear,love,fear
i feel so glad doing this,1,joy,joy,,joy,joy,joy,joy
i feel truly heartbroken that hyun joongs fans can be so hateful,0,sadness,sadness,,sadness,anger,sadness,anger
i get disappointed it makes me feel so rejected especially being disappointed by a loved one,0,sadness,sadness,,sadness,sadness,sadness,sadness
i sit in the same hostel i did nearly two months ago this time wearing a jacket and feeling as if my toes might be a little numb from the cold,0,sadness,sadness,sadness,sadness,sadness,sadness,sadness
ill find that elusive second wind and feel more hopeful but today i am a href http www,1,joy,sadness,,sadness,sadness,sadness,sadness
i could have done more but i was feeling a pleasant tiredness and had a good sweat going so i stopped at that,1,joy,joy,,joy,,joy,joy
i feel inspired so many thing i want to write down,1,joy,joy,,joy,joy,joy,joy
i came away from that expereince feeling like i had had an encounter with the divine,1,joy,joy,,joy,joy,joy,joy
i feel is an acceptable and significant modernization to the storyline not a detraction,1,joy,joy,,joy,joy,joy,joy
i say i want to be more of people person but i feel very mellow right now,1,joy,sadness,,sadness,sadness,sadness,sadness
i to feel unwelcome at her apartment certainly not,0,sadness,sadness,,sadness,,anger,sadness
i was gaining weight getting a lot stronger and feeling amazing,1,joy,joy,,joy,joy,joy,joy
i feel affirmed gracious sensuous and will have less self doubt when a href http generations,2,love,love,,,joy,joy,joy
i feel like he s a lot more playful open with me than other girls i know he s friends with,1,joy,joy,joy,joy,joy,joy,joy
i am feeling a bit offended,3,anger,anger,,anger,anger,anger,anger
i was bonded to that point in time and still feel fond of this memory,2,love,love,,love,love,love,
im feeling good these days and my only complaints are that its getting harder and harder to move around and chase after stone and its getting harder and harder to find clothes that fit,1,joy,sadness,,sadness,joy,joy,joy
i even feel a little shaky,4,fear,fear,,fear,,fear,fear
i think i was also having a pity party because i am feeling a bit frustrated with how little time i seem to have each day,3,anger,sadness,,sadness,sadness,sadness,sadness
im also still feeling whiney as hell so its possible i could rant a bit today,0,sadness,anger,,anger,anger,sadness,anger
i feel so weird but i guess kind of happy,4,fear,joy,,sadness,joy,joy,joy
i feel like the writer wants me to think so and proclaiming he no longer liked pulsars is a petty and hilarious bit of character,2,love,anger,,joy,anger,anger,anger
i feel like i am not accepted here i and bucking this force that is coming from all quarters that tells me that something is wrong with me if i am not married with children,1,joy,sadness,,sadness,sadness,sadness,sadness
im feeling generous today heres one more you may have already seen but is good for a chuckle,2,love,joy,,joy,joy,joy,joy
i feel very cheated since i am supporting the family and doing all the other stuff while he spends hours a day gaming,1,joy,anger,,anger,anger,anger,anger
i still wake up feeling suspicious,4,fear,fear,,fear,fear,fear,
i wonder if i feel under nurtured or needy,0,sadness,sadness,,sadness,sadness,sadness,sadness
i feel like im still quite bad at describing my feelings with good words and beautiful phrases,0,sadness,sadness,,sadness,,sadness,sadness
i feel more assured having made my peace with atheism,1,joy,joy,,joy,,joy,
i think im making up for feeling like i missed autumn and its great colours,0,sadness,joy,,sadness,sadness,joy,joy
i always feel a little jealous of my son because when i joined the church i went almost directly into young women so i didnt learn the primary songs,3,anger,sadness,,sadness,sadness,sadness,sadness
i went around for the rest of the day feeling distressed that i changed my appearance based on someones comments how i made myself even by coincidence more appealing to him and that just felt wrong wrong wrong,4,fear,sadness,,sadness,sadness,sadness,sadness
i see you on the pitchers mound at our little league diamond i feel so anxious for you because it looks so isolated over there,4,fear,fear,,sadness,fear,fear,fear
i no longer feel doomed to falling into the abyss with no way out,0,sadness,joy,,joy,joy,joy,
i guess its because i feel like if im too passionate about something it will get taken away from me,2,love,sadness,,sadness,fear,sadness,fear
i know nothing is going to change even i feel very envious to these people but i cant stop feeling jealous to these people because its a human beings instinct to act so,3,anger,sadness,,sadness,anger,anger,anger
ive missed that feeling and ive missed being there and ive missed having something to work towards that keeps my focus on me and keeps it off of my phone and the potential trouble it can get me in,0,sadness,sadness,,sadness,sadness,sadness,sadness
im feeling a little lethargic,0,sadness,sadness,,sadness,sadness,sadness,sadness
im feeling a lot less ugly duckling and a lot more a href http,0,sadness,joy,,joy,joy,joy,joy
i don t want to tag people who think this is silly but if there are people out there who want to be tagged i wouldn t want to make them feel unwelcome,0,sadness,sadness,,sadness,,love,
i really feel like they were gentle reminders that while god hasnt always promised an easy road he has promised to be with us as we travel the rough ones,2,love,love,,love,love,joy,
i sometimes feel like a damaged product,0,sadness,sadness,,sadness,sadness,sadness,sadness
i want you to know that if i become prime minister in less than a year s time i will be proud to do so as a friend of israel a jew and most of all someone who feels so proud to be part of the community gathered here today,1,joy,love,,joy,,joy,
i feel insulted by how those heroes of cosplay goons said they don t care if you re if,3,anger,anger,,anger,anger,anger,anger
i feel is the most important question how would we handle this,1,joy,anger,anger,fear,,fear,
i feel for all of you who have been supporting me is so extreme there would be no way to put a number value on it,1,joy,,,,love,love,love
im still feeling very emotional,0,sadness,sadness,,sadness,,sadness,sadness
i feel the need to explain myself and my thoughts in ways that are clever funny or maybe even insightful,1,joy,joy,,joy,joy,joy,joy
i feel intimidated by the tasks you feel overwhelmed by huge and complicated tasks,4,fear,fear,,sadness,,fear,
i would feel productive,1,joy,joy,,joy,joy,joy,joy
i firmly believe that the only way to go about this craft is to write the book that you feel passionate about and not to worry about finding the book that the mass audience desires,1,joy,joy,,joy,joy,joy,joy
i feel like some heroine of some tragic manga,0,sadness,sadness,,sadness,sadness,sadness,sadness
i feel proud to know several people that have deserved to be advanced for a while now and finally picked it up this time around or last time in a few peoples cases,1,joy,joy,,joy,joy,joy,joy
i ignore this voice as well knowing by now it doesn t matter if i feel humiliated by what you request of me i like that feeling i welcome that flushed hot feeling of embarrassment that you can arouse in me,0,sadness,sadness,,sadness,,joy,
i was feeling very unsure of myself and at near breaking point,4,fear,sadness,,sadness,sadness,sadness,sadness
i received a slightly belated message back from daniel and feel a lot more reassured that im not the only one who thinks l is emotionally insensitive,1,joy,sadness,,sadness,,sadness,
i only do unwillingly and always leaves me feeling grouchy and unsettled,3,anger,sadness,,sadness,anger,anger,anger
i feel numb the end of the world as we know it and i feel numb a href http leslielandberg,0,sadness,sadness,,sadness,sadness,sadness,sadness
i also tell you in hopes that anyone who is still feeling stigmatized or ashamed of their mental health issues will let go of the stigma let go of the shame,0,sadness,sadness,,sadness,,joy,sadness
i feel very honored to have been shortlisted within the patient ambassador volunteer category which recognises members of the public and staff who provide outstanding help and support through volunteering or providing patient opinions either on a public partnership forum or on a patients panel,1,joy,joy,,joy,joy,joy,joy
i can honestly say that after each sistahs chat i feel invigorated and blessed,1,joy,joy,,joy,joy,joy,joy
i offend easily when i feel my intelligence is insulted,3,anger,anger,,anger,anger,anger,anger
i write this i feel oddly calm like wanting to just relax in a big chair or lay out in the sun,1,joy,joy,,,joy,joy,joy
i imagined being in form fitting clothing that was beautiful looking in the mirror and feeling proud being lighter and more energetic,1,joy,joy,joy,joy,joy,joy,joy
i notice how different this question is from why i am feeling so agitated,4,fear,anger,,anger,anger,anger,anger
i feel so relieved and happy to realize what is being said,1,joy,joy,,joy,joy,joy,joy
i sometimes have urges to just freak out because i feel so bothered and usually nothing has caused me to feel bothered or irritated i scratch my arms when i m mad,3,anger,anger,,anger,anger,anger,anger
i honestly thought impossible at this point i feel pretty,1,joy,sadness,,sadness,joy,joy,joy
i guess it could be described as me just not really feeling like i m a part of the popular bands the up and comers or the growing local band,1,joy,sadness,,sadness,sadness,sadness,sadness
i feel agitated with myself that i did not foresee her frustrations earlier leading to the ending of our relationship,4,fear,sadness,,sadness,anger,anger,anger
i feel very honored in how much he has shared and expressed with me and that he trusts me,1,joy,love,,love,love,joy,love
i feel rebellious i wish i could do things legally i cant smoke drink or drive,3,anger,anger,,anger,anger,anger,anger
i pull out one of my favorite books to make myself feel miserable,0,sadness,sadness,,sadness,sadness,sadness,sadness
im feeling excited about it,1,joy,joy,,joy,joy,joy,joy
i feel like being sociable and just aaaah,1,joy,joy,,joy,joy,joy,joy
i just want to feel loved by you,2,love,love,,love,love,love,love
i feel like alcoholism is something that is widely accepted as the norm in gay culture,1,joy,sadness,,sadness,anger,anger,
i get to be creative if i feel like it or just sit and chat to customers the people are all lovely even kermit helps out see,2,love,joy,,joy,joy,joy,joy
i just tell people i feel like one sweet southern mess right now,1,joy,sadness,,sadness,sadness,sadness,sadness
i dont know it if is the freshness of both but i feel more energetic during these seasons,1,joy,joy,,joy,joy,joy,joy
i have to give it to men as women we complain a lot about the heals we have to wear but at least we can wear a dress and feel cool in the summer,1,joy,joy,,joy,joy,joy,
i was feeling a little sentimental today,0,sadness,sadness,,sadness,,sadness,sadness
i feel could have been avoided with some blazes markers or cairns i was very annoyed at this point,3,anger,anger,,anger,anger,anger,anger
i don t feel i can ask him what feels like a dumb question,0,sadness,anger,,fear,fear,fear,fear
i feel dirty watching this series and you can tell how the series is trying to induce false emotions in the viewer,0,sadness,anger,,anger,anger,anger,anger
i have tested positive but i have never taken drugs and i feel innocent says martina,1,joy,sadness,,sadness,,anger,
i sit here feeling drained i really wonder what will i do when i reach that point,0,sadness,sadness,,sadness,sadness,sadness,sadness
i usually end up sitting at my desk feeling like i m at work but just doing unimportant tasks or browsing the internet,0,sadness,sadness,,sadness,sadness,sadness,
i feel like life is so vain,0,sadness,sadness,,sadness,sadness,sadness,sadness
