text,label,label_text,llama31_simple,llama31_advanced,llama31_conservative,mistral7b_simple,mistral7b_advanced,mistral7b_conservative
i wrote two years ago so many things i feel unsure of maybe,4,fear,sadness,,sadness,sadness,sadness,sadness
i feel that books are always a wonderful gift for a baby,1,joy,joy,,joy,joy,joy,joy
i said before do feel free to contact me this is something i am interested in finding out more about,1,joy,joy,,,joy,joy,joy
i blamed the people around me for making me feel less valued for being a stay at home mom,1,joy,sadness,,sadness,anger,sadness,anger
ive also had a nosy on the website and seeing as its coming up to that time of year and im feeling strangely festive for once ive picked my top five products from the a href http www,1,joy,joy,joy,joy,joy,joy,joy
i feel that the packaging is really lovely and the product itself just does everything you ask,2,love,joy,joy,joy,joy,joy,joy
i feel it is perfectly acceptable to consume homemade chex party mix for breakfast during the holidays given the fact that it is mostly cereal,1,joy,joy,,joy,joy,joy,joy
i am a quiet person but what i have to say i feel is important,1,joy,anger,,sadness,anger,joy,
i never make her separate from me because i don t ever want her to feel like i m ashamed with her,0,sadness,love,,love,love,love,love
im upset with myself because i really feel like i have a blank years from years old,0,sadness,sadness,,sadness,sadness,sadness,sadness
i was gifted one of the books but am feeling a bit intimidated to take on the intricate work,4,fear,fear,fear,fear,fear,fear,fear
i feel that passionate about,1,joy,joy,joy,joy,love,joy,love
i still feel scared every time i go into a strange place,4,fear,fear,,fear,fear,fear,fear
i feel like i fucked up big time but i have to protect a and myself,3,anger,anger,,anger,fear,fear,fear
i described how i was feeling the feeling of being out of control and completely restless the fear of what could still happen my obsession with trying to do it all and the fact that it was just not working,4,fear,fear,anger,fear,fear,fear,fear
i always make things harder which im not going to lie i sometimes have a way of complicating the very simple however a new baby is a pretty big undertaking and from this comment and many many others i feel like he sees himself as being disturbed very little,0,sadness,sadness,,sadness,sadness,sadness,sadness
i still do feel left out i do feel like the most hated kid in the asian crew,3,anger,sadness,,sadness,sadness,sadness,sadness
im not sure why but im just feeling delicate,2,love,sadness,,sadness,,sadness,sadness
i can only begin to feel how distraught she must be,4,fear,sadness,,sadness,sadness,sadness,sadness
i feel kinda weird when andrea tries to talk to me about chris,4,fear,sadness,,sadness,fear,fear,fear
i didnt start feeling the excitement until the movie was almost over and then it started coming in violent waves,3,anger,joy,,anger,joy,joy,joy
i feel like it was all in vain cant be right and feel this wrong this heart of mine is just,0,sadness,sadness,,sadness,sadness,sadness,sadness
i definitely feel there s some useful information here for anyone facing similar questions to those i had during this time of my life,1,joy,joy,,sadness,joy,joy,
i look at others and feel jealous,3,anger,anger,,sadness,,sadness,anger
i am reading about s sewing circles and i feel completely happy if you cant spit in the face of imperialism at least be a lesbian,1,joy,,,joy,joy,joy,joy
i buy something i go out and look at what else i didnt buy and then after a bit of comparison here and there i suddenly feel dissatisfied with my purchase,3,anger,sadness,,sadness,,sadness,sadness
i see on wednesday im feeling fantastic these days and i can tell im getting smaller and smaller,1,joy,joy,,joy,joy,joy,joy
i feel like we may be coming to the point in the tv series where the show is incredibly popular but sadly the writers are coming to the end of their story lines and soon there will be nothing left to keep the plot a float,1,joy,sadness,,sadness,sadness,sadness,sadness
i want to be healthy and happy so badly that the fact that i am healing and without my leg is making me feel useless not empty,0,sadness,sadness,,sadness,,sadness,sadness
i feel unprotected a class post count link href http reprogramming in process,0,sadness,,,sadness,fear,fear,
i think we were both feeling a little drained from work as well,0,sadness,sadness,,sadness,sadness,sadness,
i still feel like there is a lot left to keep me entertained,1,joy,joy,,joy,joy,joy,joy
i woke up feeling fine,1,joy,joy,joy,joy,joy,joy,joy
i rarely respond to the comments made unless i have what i feel is a very important and specific reason for doing so,1,joy,anger,,anger,,joy,
im feeling energetic,1,joy,joy,,joy,joy,joy,joy
im going through life feeling now rather than being totally numb,0,sadness,sadness,,sadness,sadness,sadness,sadness
i felt apprehensive in regards to the party oftentimes in the past other men have made me feel resentful towards them when i attended with them,3,anger,anger,,anger,fear,fear,anger
i do feel apprehensive and nervous at times about how i am performing with my modules,4,fear,fear,fear,fear,fear,fear,
i spent last night on the couch feeling like i was suffering from hypothermia while the house remained at a balmy,0,sadness,sadness,,anger,sadness,anger,sadness
i feel the most unloved and unlovable,0,sadness,sadness,,sadness,sadness,sadness,sadness
i could feel my mother s sympathetic dread as i was diagnosed,2,love,sadness,,sadness,fear,sadness,sadness
i feel so blessed to be able to share it with you all,1,joy,love,joy,joy,joy,joy,joy
i hope shes feeling generous today and treat me to japanese food or something haha have a great day,1,joy,joy,,joy,joy,joy,joy
i feel like that is where i can make my most valued input and tried to do as much as possible to ensure i did an equal part in the construction,1,joy,joy,,love,,joy,
i will admit with the joy of cooking there are also times where you feel defeated,0,sadness,joy,,sadness,joy,sadness,sadness
i want to feel less stressed,0,sadness,sadness,,sadness,,sadness,
i dare myself to do the following when i m feeling brave enough,1,joy,sadness,,fear,joy,joy,joy
i guess feelings aren t meant to be inhibited or prohibited,4,fear,sadness,,sadness,,joy,
i write this th post i feel extremely delighted to buy myself a little corner in this blogger world,1,joy,joy,joy,joy,joy,joy,joy
i feel myself falling into the pit of buying it from her i think he s for real i m just skeptical of the women,4,fear,anger,,anger,fear,fear,fear
i feel this weekend is going to be a slutty one,2,love,,,,joy,joy,joy
i decided to lay down in my bed but then i started to feel really violent like i wanted to punch and kick things except i didnt wnat to hurt anything,3,anger,anger,,anger,anger,anger,anger
i reread for comfort the familiarity of a book whose plot i already know is easier to deal with when im feeling stressed than a new to me book with all its unknowns,0,sadness,sadness,,sadness,,sadness,sadness
im just feeling emo and bitchy atm,3,anger,anger,,anger,anger,anger,anger
i don t like eating meals that feel too virtuous,1,joy,anger,,anger,anger,anger,anger
im definitely not feeling fearful or anything right now,4,fear,joy,,anger,,joy,joy
i feel embarrassed that it got so bad,0,sadness,sadness,,sadness,,sadness,sadness
im feeling slightly irritable today,3,anger,anger,,anger,anger,anger,anger
i feel no need to work up acceptable conversation fodder,1,joy,sadness,,anger,anger,anger,sadness
i personally feel that it is a very creative present and everything packed inside a brown paper bag,1,joy,joy,joy,joy,joy,joy,joy
i also know what it feels like to be in a relationship where you feel like a burden and too much and not worth loving or pursuing and its just,2,love,sadness,,sadness,sadness,sadness,sadness
ive taken yoga classes for years but for the past few days i was feeling very anxious abou,4,fear,fear,anger,fear,fear,fear,fear
i apologise if the pictures are not very good quality but if youre stuck for ideas feel free to check out the websites in the captions,1,joy,,,sadness,,joy,sadness
i feel like ive come a long way and im proud of what ive achieved not only this week but this year as well,1,joy,joy,,joy,joy,joy,joy
i am not proud to be british i am not glad to be young and i most certainly do not feel blessed by opportunity,1,joy,sadness,,sadness,,sadness,
i feel reassured by their behavior on this matter and will definitely continue to do business with them,1,joy,joy,,joy,joy,joy,joy
i did feel things it was often just repressed fear and anxiety and distrust,0,sadness,fear,,fear,fear,fear,fear
i feel the pain in my vein its oh so vain am i insane,0,sadness,sadness,,sadness,sadness,sadness,sadness
i feel more virtuous just looking at the pictures in her books,1,joy,love,,love,joy,joy,joy
i feel like my room is messy if theyre open,0,sadness,sadness,,anger,,sadness,fear
i know that i have it nowhere near as worse as my brethren overseas but right now i feel like im being physically emotionally and spiritually assaulted,4,fear,anger,,anger,,anger,anger
i feel afraid agn lol whats new,4,fear,fear,,fear,fear,fear,fear
i have found that some korean men are turning to foreign women because of the freedom they feel it can be easily accounted for that dating between koreans can be a casual thing but more often than not it tends to be a serious matter,1,joy,anger,,anger,,sadness,
i have been feeling really stressed out due to homework and my studies that have increased rapidly over the last week,0,sadness,sadness,anger,sadness,sadness,fear,
i come in contact on a regular basis and the sooner i can figure out how to be kind to them in all situations the sooner they will feel valued appreciated loved and the desire to learn how to pass that kindness on to others as i am learning to do,1,joy,love,,love,joy,joy,
ive also been feeling somewhat emo irritable lately,3,anger,anger,,sadness,anger,anger,anger
i feel the vile rising in my throat flipping up the lid on the toilet to let it out,3,anger,anger,,anger,anger,anger,anger
i feel defeated but others i feel refreshed,0,sadness,sadness,,sadness,sadness,sadness,sadness
i feel accepted and loved by a community of derby girls that i helped to create,1,joy,love,,love,joy,joy,joy
i say i feel alone br style color line height,0,sadness,sadness,,sadness,,sadness,sadness
ive had a few rough days since then and in the midst of crying and dealing and feeling just so defeated and emotional i put my coat on and curled up and created this safety nest inside my coat,0,sadness,sadness,,sadness,sadness,sadness,sadness
i still feel confused and guilty about the whole thing,4,fear,sadness,,sadness,,sadness,sadness
is hand started fondling his aching cock through the fabric of his boxers and he instinctively arched his back to feel more of the delicious sensation,1,joy,,,,,joy,joy
i felt abandoned for what seemed like the millionth time in my life and i spent the last several days feeling sorry for myself when i should have been picking myself up in order to help my friends,0,sadness,sadness,,sadness,sadness,sadness,sadness
i feel like i m the one being punished,0,sadness,anger,,anger,sadness,sadness,sadness
i am off on wednesday to a postgraduate open day but there will be plenty to write about the rest of the week i feel sure,1,joy,joy,,joy,joy,joy,joy
i feel intimidated nervous and overwhelmed and i shake like a leaf,4,fear,fear,,fear,fear,fear,fear
i read her blog is that i feel that shes one person who doesnt care how people look at her and believes in being herself no matter how bitchy annoying or self centered that may seem to people,3,anger,anger,,anger,anger,joy,anger
i feel so safe and tucked away,1,joy,joy,,love,,joy,joy
i feel ungrateful for wanting more but the truth is,0,sadness,sadness,,sadness,sadness,sadness,sadness
i didnt want to be spending my days working in a job that i didnt enjoy or to come home feeling stressed and tired and not be able to give my daughter the attention she deserved,3,anger,sadness,,sadness,,sadness,sadness
i got home feeling hot tired and great,2,love,joy,,joy,joy,joy,joy
i was feeling as heartbroken as im sure katniss was,0,sadness,sadness,,sadness,sadness,sadness,sadness
i realized i was feeling really irritated while i was saying that,3,anger,anger,,anger,anger,anger,anger
i never feel lonely as long as people love and support my work,0,sadness,love,,love,joy,joy,joy
i feel the hearts decision to stop caring can it be reversed,2,love,sadness,,sadness,sadness,sadness,sadness
i feel thrilled that by the end of the month this round will be completed and i can begin to recover,1,joy,joy,,joy,joy,joy,joy
i feel like im working with half of my voice caleb and i make it through a really wonderful night at the comus inn,1,joy,joy,,joy,joy,joy,joy
i feel rotten remind me that your fruit won t spoil,0,sadness,sadness,,sadness,sadness,anger,
ive been feeling sort of depressed,0,sadness,sadness,,sadness,sadness,sadness,sadness
i could feel how much slower i was on the treadmill but the pace was pleasant and after six days of relative inactivity i was just happy to be running again,1,joy,joy,,joy,joy,joy,joy
i was still feeling hesitant last night but when i woke up i found that i had made my decision and that the slatebook somewhat to my own surprise was what i wanted,4,fear,joy,,joy,joy,joy,joy
i feel so drained at the end of a novel because i try my very hardest to get something from it that will change and impact my life,0,sadness,sadness,,sadness,sadness,sadness,sadness
i feel complacent and satisfied,1,joy,joy,,joy,joy,joy,joy
im feeling completely idiotic by not being ablo to contribute,0,sadness,sadness,,sadness,,sadness,sadness
i feel more creative,1,joy,joy,,joy,joy,joy,joy
im spending less especially on stuff that wont last long not bringing tons of stuff into the house and i feel more positive about my holiday gift giving,1,joy,joy,,joy,joy,joy,joy
i hear someone say we should just let gardeners be let folks do whatever they want i feel pretty aggravated,3,anger,anger,,anger,anger,anger,
ive come to feel about a supporting character in one of my all time favorite films giant,1,joy,sadness,,sadness,sadness,joy,sadness
i decided to actually paint this piece in a common canvas because painting in canvas make me feel very artistic,1,joy,joy,,joy,love,joy,joy
i cant help but think if id just shut up if id just not made a big deal of what was essentially two adults meeting at the same table for a hot beverage then perhaps i wouldnt have spent the bulk of the weekend feeling like a stupid shit,0,sadness,sadness,,sadness,sadness,sadness,anger
im feeling so embarrassed frightened that i wouldve smashed the window and slid in dukes of hazzard style if it would get garage man to stop glaring at me,0,sadness,anger,,anger,fear,fear,fear
i could adopt and what messages i could think about to help make me feel more peaceful more grateful and just happier right now,1,joy,sadness,,sadness,joy,joy,joy
