text,label,label_text,llama31_simple,llama31_advanced,llama31_conservative,mistral7b_simple,mistral7b_advanced,mistral7b_conservative
i feel very honoured to have been part of the bond family and very much hope i have a chance to work with them again sometime in the future,1,joy,joy,,joy,joy,joy,joy
i feel like he moves sleep i am glad i enjoyed that week of good sleep that i mentioned because i have a feeling that is over with now,1,joy,sadness,,sadness,sadness,sadness,sadness
im not constantly horny or always feeling playful,1,joy,anger,,sadness,anger,sadness,anger
i had a fab christmas and an amazing new year with my family and friends and against all odds i feel very optimistic about,1,joy,joy,joy,joy,joy,joy,joy
i never feel like im not supporting,1,joy,sadness,,sadness,joy,joy,
i wanna feel that gorgeous body a yers underneath me next time i m fuckin ya alex took a deep breath and her eyes seemed to glow while she imagined the scenario in her mind a scene she had pictured many times before,1,joy,,,,love,love,love
i feel myself about how successful my attempts are im starting to connect with the fact that people want to hear music not perfection whatever that is,1,joy,joy,,joy,joy,joy,joy
im so proud of you no words can describe the way that makes my heart feel thank you god for my supportive amazing hubbard,2,love,love,,love,joy,joy,joy
i made that make me feel dumb and dumber,0,sadness,anger,,sadness,sadness,sadness,sadness
i feel happy about this solution,1,joy,joy,,joy,joy,joy,joy
i said at the beginning i have combination oily skin but i still use this around once a week because my skin feels absolutely gorgeous the morning after applying it,1,joy,joy,,joy,joy,joy,joy
i start to feel emotional,0,sadness,sadness,,sadness,,sadness,sadness
i wonder if im vain because i love dressing up and attempting to be fashionable but then i realized that there is nothing wrong with dressing so that you feel pretty cute smart whatever,1,joy,sadness,,sadness,joy,joy,joy
i feel smart when i figure things out myself,1,joy,joy,,joy,joy,joy,joy
i feel less shy about exploring roles in more physical ways,4,fear,joy,,joy,joy,joy,joy
i feel blessed that i have people in my life who remind me all the time that i did the right thing and that i look better like this,2,love,joy,,joy,joy,joy,joy
i am going to have to check on in just a few minutes but there is this clock up above the screen that keeps ticking down the minutes i have left so am feeling a bit frantic,4,fear,fear,,fear,fear,fear,fear
i lift different now because it hurt so bad the day it happened that i can t get it out of my mind and i feel myself being a bit timid,4,fear,sadness,,sadness,sadness,sadness,sadness
i then feel your tender touch as you enfold me with his love,2,love,love,love,love,love,love,love
i don t want them to feel so pressured,4,fear,sadness,,sadness,sadness,sadness,sadness
im feeling dangerous and ill just write and figure out where the hell itll take me,3,anger,anger,,fear,anger,anger,fear
i don t really believe because i walked through all the water stops in my first marathon and i actually don t think that walking is bad but dammit i was feeling stubborn and i wanted to get home and needed to be motivated by something,3,anger,anger,,anger,anger,anger,
im feeling really really sarcastic caustic or theres been an influx of idiots into my flists daily lives,3,anger,anger,,anger,sadness,anger,anger
i feel less frightened and more grounded and centered,4,fear,fear,,fear,,joy,joy
i was feeling pretty anxious all day but my first day at work was a very good day and that helped a lot,4,fear,joy,,joy,joy,joy,joy
i wake up feeling like something terrifyingly bad is bound to happen to me before i even get a chance to stick a limb outside of my covers,0,sadness,fear,,fear,fear,fear,fear
i have found myself fighting back as he wakes me from my sleep time and time again feeling the hurt and sting of my own abandonment to my first love,0,sadness,sadness,,sadness,,sadness,sadness
im learning mandarin chinese now in preparation for a trip to tianjin this september and already only four lessons in i feel like i have a handle on the basics and im thrilled to have some insight into a language that had always been a total mystery to me,1,joy,joy,joy,joy,joy,joy,joy
i dont really care and i dont feel proud of myself at all,1,joy,sadness,,sadness,sadness,sadness,sadness
i feel shaky from the battering of emotions but im still standing,4,fear,sadness,,sadness,sadness,sadness,sadness
i feel rotten but no amount of suggesting that losing a sense of smell is a terribly disorientating experience for a wine person seems to convince people that i might not actually live to feel good again,0,sadness,sadness,,sadness,sadness,sadness,sadness
i see all my friends posting pics and status updates of where they are going or what they are doing and i feel a bit jealous knowing it s not something i can get out and enjoy,3,anger,sadness,,sadness,sadness,sadness,sadness
i feel like it might just be ok,1,joy,joy,,sadness,joy,joy,joy
i hope i get the job cause im in desperate need of money and i feel greedy,3,anger,anger,,anger,anger,anger,anger
i am on top of my game and my fingers feel strong and loose,1,joy,joy,,joy,joy,joy,joy
i first read this book during college and it has helped me cope with the feeling of helplessness and fear of the uncertain future,4,fear,fear,fear,fear,fear,fear,fear
i wasnt feeling well yesterday morning afternoon so i just laid in bed and ended up in the all too familiar youtube black hole,1,joy,sadness,,sadness,sadness,sadness,sadness
i was feeling particularly pissed off and wanted to go to a party,3,anger,anger,,anger,anger,anger,anger
i always feel really confident of my life and my choices when i go home,1,joy,joy,,joy,joy,,joy
i wont lie this week has been abit of a difficult week for me ive been feeling very stressed and anxious this week plus i think im coming down with the flu but it has definately helped me to appreciate the little things,3,anger,sadness,,sadness,sadness,sadness,sadness
i wasn t sure what this gnawing feeling i was having but i was getting agitated sitting around doing nothing,3,anger,anger,,anger,anger,anger,anger
i am now and i still feel the aching loneliness of that quiet hospital room,0,sadness,sadness,,sadness,sadness,sadness,sadness
i do take on a half marathon challenge then i will wait and see how the body feels as to whether there will be a pb attempt or a casual kilometre shuffle,1,joy,joy,,joy,,joy,joy
i remember leaving church feeling invigorated every sunday and tuesday night,1,joy,joy,,joy,joy,joy,joy
i feel honoured that such a great man claims me as his friend,1,joy,love,,love,joy,joy,joy
i am not a people person but for some fuckin reason people feel that they can come bore me with their fuckin petty garbage,3,anger,anger,,anger,anger,anger,
i think about the things ive said and the stuff i have done it makes me feel disgusted in myself when i should be making you happy and smile which i was far from doing,3,anger,sadness,,sadness,sadness,sadness,sadness
i got a great pump and halfway through the workout i started to feel fantastic,1,joy,joy,,joy,joy,joy,joy
i just feel totally useless today,0,sadness,sadness,,sadness,sadness,sadness,sadness
i was supposed to feel sympathy for emma im afraid i failed,4,fear,sadness,,sadness,sadness,sadness,sadness
i can t help but feel really nostalgic of the disney levels,2,love,sadness,,sadness,sadness,joy,
i realized what i am passionate about helping women feel accepted and appreciated,1,joy,love,,love,joy,joy,joy
i feel transcendant and splendid,1,joy,joy,,joy,joy,joy,joy
i feel a lot of affection for you that is longing to be conveyed,2,love,love,,love,love,love,love
i do not feel assured,1,joy,sadness,,sadness,sadness,sadness,
i have some pretty brazen goals and each day i feel stronger and more confident that i m going to reach my desired end result,1,joy,joy,,joy,joy,joy,joy
i feel like a naughty school girl because i am falling behind,2,love,sadness,,sadness,sadness,sadness,sadness
i feel disillusioned with the occult so i have come to feel a greater connection to the earth,0,sadness,sadness,,sadness,sadness,sadness,sadness
im feeling and if ive liked being pregnant,2,love,sadness,,sadness,joy,sadness,joy
i have a feeling that its too sociable,1,joy,sadness,,sadness,,joy,joy
i basically spent a miserable night crying and feeling terrified and sick to my stomach,4,fear,sadness,,fear,fear,fear,fear
i am up and ready to read read read today even though im feeling very groggy this morning,0,sadness,joy,,joy,joy,joy,joy
i have asthma and when i can barely breathe when it s hard i feel very shaky and weak i feel like not doing anything but lie there helplessly and i feel like collapesing i did so much reseach and i got nothing,4,fear,sadness,,sadness,fear,sadness,fear
i sat up to embrace them and realised that two hours spent shaking my thang in an eighties bar celebrating the fact i am one year closer to death had left my ageing body feeling punished and my normally pink feet blackened,0,sadness,sadness,,sadness,,sadness,
im starting to feel really pathetic giving the bulk of my enthusiasm these days to the kardashians us weekly and roseanne marathons and completely ignoring this blog,0,sadness,sadness,,sadness,sadness,sadness,sadness
i honestly wish christmas was celebrated in the summer because i feel like i tend not be as jolly as i wish i could be,1,joy,sadness,,sadness,,joy,sadness
ive never done a detox or cleanse before and i really had no desire to i feel like cleanses cycle around and become popular every couple of years and id pretty much written them off,1,joy,anger,,anger,anger,anger,anger
i just feel so virtuous when we go on a fieldtrip,1,joy,joy,,joy,joy,joy,joy
i listen to the advice of my eating disorder will i actually feel better,1,joy,sadness,,sadness,sadness,sadness,
i am feeling very indecisive and spontaneous,4,fear,sadness,,sadness,,joy,joy
im feeling really out of place and irritated,3,anger,anger,,anger,,anger,anger
im feeling more lively than yesterday still not sure about food though,1,joy,joy,,joy,joy,joy,joy
i feel completely burdened with my own intelligence,0,sadness,sadness,,sadness,sadness,sadness,sadness
i can feel the rebellious spirit already,3,anger,anger,,anger,anger,joy,anger
i want each of you to feel my gentle embrace,2,love,love,,love,love,love,love
i like being in church on sundays it makes me feel more virtuous how self effacing and more settled for the week ahead,1,joy,joy,,joy,joy,joy,joy
i feel even more determined to keep up our once per week tradition that my son started,1,joy,joy,,love,joy,joy,joy
i exactly feel whenever i feel lonely or depressed and then i pray to him for help and guidance a href http,0,sadness,sadness,,sadness,,sadness,sadness
i dont want to always be judgmental of particular men or scenarios that i often see in this area but with so much trafficking forced sex work and what basically amounts to slavery its hard not to feel slightly embittered and disillusioned,0,sadness,sadness,,sadness,anger,anger,anger
i feel as though it is worthwhile and career wise,1,joy,joy,,joy,joy,joy,
i would do almost anything to have that feeling back and those days back they were carefree and wonderful and now everything in my life is just so complicated,1,joy,sadness,,sadness,sadness,sadness,sadness
i feel so greedy so needy so helpless,3,anger,sadness,,sadness,anger,sadness,sadness
ive been missing him and feeling so restless at home thinking of him,4,fear,sadness,,sadness,sadness,sadness,sadness
i do feel proud and happy and also very grateful to all who read me,1,joy,joy,,joy,joy,joy,joy
im much more peaceful and happy when the house is clean the food is good and my kids arent feeling needy,0,sadness,joy,,joy,joy,joy,joy
im feeling greedy for right now,3,anger,anger,,joy,,joy,joy
i entered the office though feeling the monday blues with a joyful and serene spirit dominating,1,joy,joy,,joy,joy,joy,love
i wish i could bottle her squeals of delight and take them out whenever im feeling grumpy,3,anger,joy,,joy,joy,joy,joy
ive left the orange scented mixture white but feel free to color it if you wish,1,joy,,,joy,,joy,
i was cooking my dinner feeling pretty melancholy when zane lowe gave it the first spin on his radio one show on tuesday and the song matched my mood perfectly,0,sadness,sadness,,sadness,sadness,sadness,sadness
i have a feeling i will be dissatisfied several times,3,anger,sadness,,sadness,sadness,sadness,sadness
i assumed it would feel casual,1,joy,sadness,,sadness,,joy,
i don t have the feeling of divine vibrations,1,joy,sadness,,sadness,,sadness,sadness
im in such a happy mood today i feel almost delighted and i havent done anything different today then i normally have it is wonderful,1,joy,joy,,joy,joy,joy,joy
i feel so worthless and useless these past weeks just because im a certified by stander at home,0,sadness,sadness,,sadness,sadness,sadness,sadness
i am trying my hardest so i can get to a place where i can join you and finally feel like i have something worthwhile to say,1,joy,sadness,,sadness,sadness,love,sadness
im happy but i feel all this pressure to do one thing or another amp it makes me unhappy,0,sadness,sadness,,sadness,joy,sadness,anger
i feel no positive regard,1,joy,sadness,,sadness,sadness,sadness,sadness
i can choose to tell the whole word what im feeling now or just fake it with some happy stories,0,sadness,sadness,,sadness,sadness,sadness,sadness
i know what it feels like to be scared into something,4,fear,fear,,fear,fear,fear,fear
i feel so blessed to be married to him because he loves his stepchildren,1,joy,love,,love,joy,joy,joy
i don t know about you but i m feeling amp blessed,1,joy,joy,,joy,joy,joy,joy
i remember feeling envious but then why would a young healthy person envy someone who s just barely survived,3,anger,sadness,,sadness,sadness,sadness,
i can easily feel quite pressured by routines and i really noticed the difference while i was away,4,fear,sadness,,sadness,sadness,sadness,fear
i don t feel comfortable playing games with them presenting the bad guy as really a misunderstood good guy or vice versa,1,joy,anger,,anger,anger,anger,
i also feel i have accepted my dark side and am finally realizing what of my dark side is healthy,1,joy,sadness,,sadness,sadness,joy,love
im feeling ecstatic about right now the classy ever after redesign project begins this week,1,joy,joy,,joy,joy,joy,joy
i should pull out if i feel resentful or edgy,3,anger,anger,,anger,anger,anger,anger
i loved about ellie is that she didnt feel insulted by all the rude douche baggy things lothaire said to her because according to ellie insults only hurt when they come from somebody you respect damn straight,3,anger,joy,,joy,joy,joy,joy
i do is priceless and i feel so honoured for every mum and dad who trusts me with their new arrival,1,joy,love,joy,love,,joy,joy
i feel unimportant when he spends nights out with sara and i get no phone call,0,sadness,sadness,,sadness,sadness,sadness,sadness
i might do so simply because i couldnt keep my mouth shut makes me feel terrible,0,sadness,sadness,,sadness,sadness,sadness,sadness
i was feeling a bit jaded that day but told myself why the hell not,0,sadness,anger,,anger,joy,joy,
i feel pressured to do well and i fe,4,fear,sadness,anger,sadness,,fear,fear
i feel a little scared about this because it is new to me and i have a lot to learn but im sure everything is going to be fine and we can do this together,4,fear,fear,,fear,,fear,fear
i feel he is a terrific actor,1,joy,joy,joy,joy,joy,joy,joy
i might hold a sense of satisfaction at feeling superior and giving advice,1,joy,anger,,anger,sadness,joy,
i feel beaten down and i feel void,0,sadness,sadness,,sadness,sadness,sadness,sadness
i dont know if i feel thrilled at finally getting to go camping again with people i like and know first time where thats happened,1,joy,joy,,joy,joy,joy,joy
i know that you feel pretty disgusted by the nonstop lefty propaganda the ministry churns out but of the public isn t that tuned in,3,anger,anger,,anger,,anger,
i is desperate for kareena akshay kumar will play a double role in flash forward minissha says i still feel today amisha patel in a glamorous avtaar,1,joy,,,joy,anger,joy,anger
i continue to feel so content about our decision to move here,1,joy,joy,,joy,joy,joy,joy
i feel like we are doomed us humans,0,sadness,sadness,,sadness,sadness,sadness,sadness
im not the one who feel bothered about this,3,anger,anger,,anger,anger,anger,
im feeling very doubtful about the necessity of that big coat,4,fear,sadness,,sadness,,fear,fear
i feel so amazing musicjuzz,1,joy,joy,joy,joy,joy,joy,joy
i also baked enough cookies to take to my local bbw tomorrow night i feel so bad for the employees who have to work,0,sadness,sadness,,sadness,sadness,sadness,sadness
i could feel his breath on me and smell the sweet scent of him,1,joy,love,love,love,love,love,
i look at their situation and feel so so jealous that i almost cant bear it,3,anger,anger,,anger,,sadness,anger
i stand in front of mansoor s works i feel obviously that the artistic intention is not to raise the already raised questions of structural linguistics and the deconstructionist clamours that followed it,1,joy,anger,,anger,,anger,
i receive every month make me proud and feel appreciative,1,joy,joy,,joy,joy,joy,joy
i am feeling depressed cursing my luck,0,sadness,sadness,,sadness,sadness,sadness,sadness
i feel like i wouldnt have a longing if only we could have a baby and have that new experience together,2,love,sadness,,sadness,love,love,
i have to take jenny in to be spayed so of course im feeling nervous and guilty,4,fear,sadness,anger,sadness,fear,fear,fear
i feel very indecisive about it,4,fear,sadness,,sadness,sadness,sadness,
i feel like im so distracted most days,3,anger,sadness,,sadness,,sadness,sadness
i am balancing on my hands with my feet hanging over and it feels like pretty far and im terrified to let them drop but im totally calm at the same time hanging here,4,fear,fear,fear,fear,fear,fear,fear
i was younger i used to feel homesick,0,sadness,sadness,,sadness,sadness,sadness,sadness
im feeling pretty anxious,4,fear,fear,,fear,fear,fear,fear
i feel like a bit of an ungrateful fool for not having written anything about him last week,0,sadness,sadness,,sadness,sadness,sadness,sadness
i am finally starting to feel like i have a real life here in san vicente and i am no longer on a strange confusing extended vacation,4,fear,joy,,joy,joy,joy,joy
im a big guy and ive gotten into some of the rigs that weve worked with to try them out and see what they feel like and let me tell you it was less than pleasant,1,joy,anger,,anger,anger,anger,anger
i randomly heard this and ever since then watching the video has been a delight and the music just makes me feel as jolly in reference,1,joy,joy,,joy,joy,joy,joy
i dont want flowers or candy but the kind of guy that knows i like thinly sliced limes in my mineral water because it makes me feel glamorous and is humored by how pretentious that is,1,joy,joy,,love,joy,joy,joy
i think ive just been feeling a little bothered,3,anger,sadness,,sadness,anger,sadness,anger
i feel inside coz i m so fucking horny,2,love,,,,joy,joy,joy
i feel cared for and accepted,2,love,love,,love,love,love,love
i also feel it helped the newbie bloggers connect and feel welcomed immediately,1,joy,joy,,joy,joy,joy,joy
i feel terrific in every one of them,1,joy,joy,,joy,joy,joy,joy
i wouldnt say that i suffer from social discomfort at the moment because ive found places where i feel comfortable and even people who have accepted me the way i am,1,joy,joy,,joy,joy,joy,joy
i am still healing from having my heart broken still healing from broken dreams still doubting myself still feeling confused,4,fear,sadness,,sadness,sadness,sadness,sadness
i feel calm silent and protected by the definiteness of this existence,1,joy,,,,,joy,
im in that last bit of sleep before i get up in the morning i feel like that emotional energy just waits for me,0,sadness,sadness,,sadness,sadness,fear,fear
i am feeling bitchy this evening,3,anger,anger,,anger,anger,anger,anger
i didn t mean to get angry with you bommie i just can t control my feelings hellip i just hated myself why i am like this the dara who can t get over with that b,0,sadness,sadness,,sadness,,sadness,
i feel i might have lost the potty training train,0,sadness,sadness,,sadness,sadness,sadness,sadness
i feel god in my life more now than i ever have before and things are so wonderful right now,1,joy,joy,,joy,joy,joy,joy
i feel totally completely accepted and loved while my heavenly abba was pointing out sin in my life,2,love,love,,love,love,anger,love
i wanna feel good again,1,joy,sadness,,sadness,joy,joy,joy
i enjoy about his work is the genuine feel and the pleasant message he is trying to deliver with all this,1,joy,joy,,joy,joy,joy,joy
i feel like i m finally losing that stubborn little bit of extra stuff in my lower belly,3,anger,joy,,joy,joy,joy,joy
i never draw on both sides of the pages and like to know i can add to drawings when i feel like it rather than feeling pressured that they have to be finished all in one go,4,fear,joy,,joy,sadness,joy,sadness
i feel like i entertained sd all day,1,joy,joy,,sadness,joy,joy,joy
i feel so pathetic and useless being unable to do anything,0,sadness,sadness,,sadness,sadness,sadness,sadness
i feel stupid whenever this happens,0,sadness,sadness,,sadness,sadness,sadness,sadness
i see the look of doubt on your face i feel the scorn in your eyes but for anyone skeptical of grits dinner grits please see this as a totally amazing sister to mashed potatoes,4,fear,anger,,anger,joy,joy,joy
i don t know what to feel as in i am not sure should i feel sad cause it is ending or should i feel glad that it is over and i can move on,1,joy,sadness,,sadness,sadness,sadness,
i am of snuffling and feeling dull,0,sadness,sadness,,sadness,sadness,sadness,sadness
i forgive myself that i have accepted and allowed myself to think that as i am writing this blog that someone will feel sorry for me give me some sympathy and tell me i am right,0,sadness,anger,,sadness,sadness,sadness,sadness
i feel the need to layer on fake tan for a night out to give me a bit of colour my clothes do it for me,0,sadness,joy,,sadness,,sadness,joy
i was feeling the need for some christmas crafting this week especially after seeing a couple of lovely quilty christmas projects at stitch group,2,love,joy,joy,joy,joy,joy,joy
i am going to actively learn more about these genres and or practice them so i can feel what i should feel as a dancer gt fearless courageous confident phew,1,joy,joy,,joy,joy,joy,joy
i feel that poachers and others who kill animals for their pelts ivory or other parts should be punished severely i find hunting and fishing cruel,0,sadness,anger,,anger,,anger,anger
i usually ignore page invites that are irrelevant to me or facebook game invites because its impersonal and it feels insincere,3,anger,anger,,anger,anger,anger,anger
i help my daughter when she is feeling angry,3,anger,anger,,anger,,joy,anger
i were to go overseas or cross the border then i become a foreigner and will feel that way but never in my beloved land,2,love,love,,sadness,love,love,love
i will admit and it left me feeling shaken and a bit of a goose,4,fear,sadness,,sadness,,fear,fear
i feel so blessed and honored that we get to be its parents,2,love,love,,love,joy,joy,joy
i feel a little nervous i go to the gym,4,fear,anger,,fear,fear,fear,
i feel about these individuals but that opening line shows how inadequate simple words can be,0,sadness,sadness,,sadness,sadness,sadness,sadness
i feel like i m going to struggle and fail and suffer and be really dumb,0,sadness,sadness,,sadness,sadness,sadness,sadness
i feel its sad but im okay with it im happy i had done it even though it hurts a little,0,sadness,sadness,,sadness,sadness,joy,joy
i feel immensely distracted by the barrage of media i receive solicit,3,anger,anger,,anger,sadness,fear,
im feeling quite positive in what i want to achieve,1,joy,joy,,joy,joy,joy,joy
i see people who physically resemble me i feel confident to strike up conversations with strangers,1,joy,joy,,joy,joy,joy,joy
i left there feeling brow beaten,0,sadness,sadness,,sadness,,sadness,
i didn t feel pressured or constrained in my choices to behave in a particular way i just felt very busy,4,fear,sadness,,sadness,joy,joy,joy
i have no strong feelings for this book neither hated nor loved it,3,anger,,,,sadness,sadness,
i feel betrayed and angry and sad at the same time dammit,3,anger,anger,,anger,anger,anger,anger
i was learning to just deal with the nausea amp manage the unpleasantness of it at work trying to keep anyone from knowing but my sister told me there was no need to suffer amp feel miserable amp to call my dr for some zofran,0,sadness,sadness,,sadness,sadness,sadness,sadness
i feel annoyingly isolated in the hostel with all those people talking outside the room etc,0,sadness,sadness,,sadness,,anger,
i woke up i feel thankful to god for giving me another day to go on,1,joy,joy,,joy,joy,joy,joy
i feel anger i feel sad i feel joy and i feel other emotions too but will stick to a few,0,sadness,anger,,sadness,sadness,joy,anger
i feel is entirely more dangerous,3,anger,anger,,anger,,fear,
i feel it is really valuable to contemplate on that phrase thy will be done in all of our lives,1,joy,love,,love,joy,joy,
i feel like that line is so perfect,1,joy,joy,,joy,joy,joy,joy
im sure i will feel fine in the morning,1,joy,sadness,,sadness,joy,sadness,joy
i feel a bit dull by it all,0,sadness,sadness,,sadness,sadness,sadness,sadness
